Region;Title;Licht;Linse;Details;Maps;Image
Torres Del Paine;Mirador Cuernos;Morgen/Vormittag;24-70mm;"Spektakulärer Blick auf die ""Hörner"" über dem türkisfarbenen Lake Nordenskjöld. Einfacher Weg.";https://www.google.com/maps/search/?api=1&query=Mirador+Cuernos+Torres+del+Paine;https://images.unsplash.com/photo-1544198365-f5d60b6d8190?auto=format&fit=crop&w=800&q=80
Torres Del Paine;Salto Grande;Nachmittag;16-35mm;Wuchtiger Wasserfall mit den Bergen im Hintergrund. Kurzer Spaziergang vom Parkplatz.;https://www.google.com/maps/search/?api=1&query=Salto+Grande+Torres+del+Paine;https://images.unsplash.com/photo-1504280390367-361c6d9f38f4?auto=format&fit=crop&w=800&q=80
Torres Del Paine;Lago Pehoé Insel;Sonnenaufgang;16-35mm;Der Klassiker: Die kleine Insel mit der Hostería vor dem Massiv. Bei Wind tolle Wellen am Ufer.;https://www.google.com/maps/search/?api=1&query=Hosteria+Pehoe+Viewpoint;https://images.unsplash.com/photo-1510444315264-5a2108168233?auto=format&fit=crop&w=800&q=80
Torres Del Paine;Laguna Amarga;Sonnenaufgang;70-200mm;Perfekt für die erste Morgenröte an den Türmen. Oft Spiegelungen bei Windstille.;https://www.google.com/maps/search/?api=1&query=Laguna+Amarga+Torres+del+Paine;https://images.unsplash.com/photo-1548563300-84f98df311e6?auto=format&fit=crop&w=800&q=80
Torres Del Paine;Laguna Azul;Morgen;24-105mm;Einer der besten Blicke auf die drei Türme ohne langes Trekking. Viele Guanakos in der Gegend.;https://www.google.com/maps/search/?api=1&query=Laguna+Azul+Torres+del+Paine;https://images.unsplash.com/photo-1519280031023-9524029f60d6?auto=format&fit=crop&w=800&q=80
Torres Del Paine;Route zum Lago Grey;Nachmittag;Tele;Auf der Fahrt Richtung Grey Glacier gibt es oft Pferde auf weiten Ebenen vor den Bergen.;https://www.google.com/maps/search/?api=1&query=Rio+Grey+Bridge+Torres+del+Paine;https://images.unsplash.com/photo-1533038595781-061b4724bc27?auto=format&fit=crop&w=800&q=80
Torres Del Paine;Dead Trees Area;Vormittag;24-70mm;Skelettartige tote Bäume als bizarrer Vordergrund vor dem Paine Massiv. Direkt nördlich vom Salto Grande.;https://www.google.com/maps/search/?api=1&query=Salto+Grande+Parking+Torres+del+Paine;https://images.unsplash.com/photo-1510137617676-e820c7490218?auto=format&fit=crop&w=800&q=80
Torres Del Paine;Rio Serrano Viewpoint;Abend;16-35mm;Weiter Blick über den Fluss auf das gesamte Massiv. Besonders schön bei tiefstehender Sonne.;https://www.google.com/maps/search/?api=1&query=Mirador+Rio+Serrano+Torres+del+Paine;https://images.unsplash.com/photo-1528659101416-834c9c22e49c?auto=format&fit=crop&w=800&q=80